1238771,/auteur/Pierre-Ducrozet/102577,Le grand vertige,"Pionnier de la pensée écologique, Adam Thobias est sollicité pour prendre la tête dune Commission internationale sur le changement climatique et pour un nouveau contrat naturel. Pas dupe, il tente de transformer ce hochet géopolitique en arme de reconstruction massive. Au cur du dispositif, il crée le réseau Télémaque, mouvant et hybride, constitué de scientifiques ou dintuitifs, de spécialistes ou de voyageurs quil envoie en missions discrètes, du Pacifique s",3.44,142,"[1375775, 1006776, 1276744, 1314022, 1463304]","[' roman  ', ' thriller  ', ' utopie  ', ' planète  ', ' attentats  ', ' nature  ', ' roman écologique  ', ' littérature  ', ' climat  ', ' pétrole  ', ' science-fiction  ', ' politique  ', ' géopolitique  ', ' voyages  ', ' économie  ', ' rechauffement climatique  ', ' écologie  ', ' littérature francophone  ', ' littérature française  ', ' français  ', 'écologie', 'Voir plus', 'écologie', 'developpement durable', 'Consommation durable', 'protection de la nature', 'protection animale', ""protection de l'environnement"", 'pédagogie', 'mers et océans']"
6590,/auteur/Rene-Barjavel/3386,Ravage,"""Vous ne savez pas ce qui est arrivé ? Tous les moteurs d'avions se sont arrêtés hier à la même heure, juste au moment où le courant flanchait partout. Tous ceux qui s'étaient mis en descente pour atterrir sur la terrasse sont tombés comme une grêle. 
Vous n'avez rien entendu, là-dessous ? Moi, dans mon petit appartement près du garage, c'est bien un miracle si je n'ai pas été aplati. Quand le bus de la ligne 2 est tombé, j'ai sauté au plafond comme u",3.92,7135,"[410521, 432136, 10514, 178723, 761145]","[' aventure  ', ' roman  ', ' dystopie  ', ' anticipation  ', ' roman de science-fiction  ', "" roman d'anticipation  "", ' fantastique  ', ' classique  ', ' post-apocalyptique  ', ' Catastrophes  ', ' apocalypse  ', ' fin du monde  ', ' survie  ', ' littérature  ', ' société  ', ' science-fiction  ', ' france  ', ' littérature française  ', ' français  ', ' 20ème siècle  ', 'science-fiction', 'Voir plus']"
1243013,/auteur/Laurine-Roux/464595,Le Sanctuaire,"Une famille a trouvé refuge en pleine montagne, où elle tue les oiseaux et les brûle au lance-flammes : ils seraient à l'origine d'un mal ayant conduit l'humanité à son extinction. Tandis que la mère pleure et chante son existence passée, le père seul s'aventure aux confins de leur « sanctuaire », d'où il rapporte tout ce qu'il trouve pour assurer la survie des siens. Mais le monde est-il vraiment devenu ce qu'il en dit ? Est-il jonché de cadavres qui pourrissent le",3.63,477,"[1450095, 1288669, 1286386, 1142734, 1286712]","[' roman  ', ' dystopie  ', ' anticipation  ', ' virus  ', ' survivalisme  ', ' folie  ', ' mensonges  ', ' oiseaux  ', ' post-apocalyptique  ', ' huis-clos  ', ' survie  ', ' nature  ', ' violence  ', ' adolescence  ', ' épidémie  ', ' science-fiction  ', ' famille  ', ' nature writing  ', ' montagnes  ', ' littérature française  ', 'épidémie', 'Voir plus', 'science-fiction']"
9072,/auteur/Georges-Jean-Arnaud/6027,"La compagnie des glaces - Intégrale, tome 1","Sur une Terre envahie par les glaces, la survie de l'espèce humaine est assurée par les grandes compagnies ferroviaires qui se partagent le globe. Le rail apporte chaleur, nourriture, mais aussi une dictature impitoyable. Mêlé malgré lui aux intrigues de la Compagnie, le glaciologue Lien Rag va s'intéresser un peu trop à l'origine des Hommes Roux, capables de résister à des températures de moins quarante, et découvrir la dangereuse ivresse de la révolte.",3.78,170,"[410521, 12367, 10308, 27343, 17089]","[' roman feuilleton  ', ' aventure  ', ' serie  ', ' roman  ', ' anticipation  ', ' fantastique  ', ' bande dessinée  ', ' post-apocalyptique  ', ' mystère  ', ' dictature  ', ' complots  ', ' fin du monde  ', ' froid  ', ' idée  ', ' science-fiction  ', ' religion  ', ' génétique  ', ' science  ', ' littérature française  ', ' 20ème siècle  ', 'science-fiction', 'Voir plus']"
480130,/auteur/Paolo-Bacigalupi/51616,Ferrailleurs des mers,"Fin du XXIe siècle, il ny a plus de pétrole, la mondialisation est un vieux souvenir et la plupart des États-Unis un pays du tiers-monde. Dans un bidonville côtier de Louisiane, Nailer, un jeune ferrailleur, dépouille avec dautres enfants et adolescents les carcasses de vieux pétroliers. Le précieux cuivre récupéré dans les câblages électriques au péril de leur vie leur permettent à peine de se nourrir. Un jour, après une tempête dévastatrice, Nailer découvre un b",3.79,157,"[491135, 1495449, 982190, 1025953, 62744]","[' aventure  ', ' roman  ', ' anticipation  ', ' dystopie  ', ' littérature jeunesse  ', ' jeunesse  ', ' littérature pour adolescents  ', ' jeune adulte  ', ' adolescence  ', ' amitié  ', ' post-apocalyptique  ', ' survie  ', ' mondialisation  ', ' misère  ', ' science-fiction  ', ' bateaux  ', ' mer  ', ' aventure maritime  ', ' pirates  ', ' littérature américaine  ', 'science-fiction', 'Voir plus', 'science-fiction']"
1249127,/auteur/Richard-Canal/84774,Upside down,"Au début du XXIe siècle, les dirigeants des GAFAM et autres NATU portaient les rêves d'une humanité enfin débarrassée de la maladie et de la mort. Ils ont réussi. Dans des îlots artificiels en orbite basse, ils jouissent désormais, à chaque instant, des illusions infantiles du bonheur.
Le reste de l'humanité survit tant bien que mal sur une Terre rouillée, épuisée, victime de désastres écologiques à répétition. Son histoire n'est pas la même. Le bonhe",3.4,30,"[1121377, 1249119, 1394618, 1060231, 1277327]","[' littérature générale  ', ' Romans et nouvelles de genre  ', ' dystopie  ', ' anticipation  ', ' cli-fi  ', ' intelligence artificielle  ', ' pollution  ', ' clonage  ', ' roman choral  ', ' écofiction  ', ' sfff  ', ' science-fiction  ', 'science-fiction', 'Voir plus', 'science-fiction']"
1251698,/auteur/Mathieu-Bablet/136443,Carbone & silicium,"Nés dans un laboratoire de la Silicone Valley, deux androïdes, Carbone et Silicium, vont être les témoins du changement vers notre humanité future. Ce moment où la technologie de l'intelligence artificielle, pinacle de l'accomplissement humain, va entrer en confrontation directe avec les crises écologique, économique et migratoire. Cest avec leurs yeux que nous allons redécouvrir notre planète Terre ayant atteint le fameux point de non-retour annoncé par les scient",4.25,1449,"[814742, 982248, 1353551, 1559422, 1241262]","[' dystopie  ', ' anticipation  ', ' cyberpunk  ', ' bande dessinée  ', ' bd adulte  ', ' roman graphique  ', ' humanité  ', ' robots  ', ' société  ', ' post-apocalyptique  ', ' androïde  ', ' one-shot  ', ' intelligence artificielle  ', ' science-fiction  ', ' métaphysique  ', ' politique  ', ' amour  ', ' écologie  ', ' philosophie  ', ' littérature française  ', 'intelligence artificielle', 'Voir plus', 'bd franco-belge', 'bande dessinée', 'bd jeunesse', 'bd belge', 'bande dessinée aventure', 'aventure jeunesse', 'tintinophile', 'ligne claire', 'personnages', 'Personnages fictifs']"
